{"$id":"urn:lima:v4:lima.vulnerability-evidence-package","$schema":"https://json-schema.org/draft/2020-12/schema","additionalProperties":false,"properties":{"claim_kind":{"enum":["runtime_exploitability","static_property"],"type":"string"},"cwe_ids":{"items":{"type":["object","string"]},"maxItems":4096,"type":"array"},"evidence":{"items":{"type":["object","string"]},"maxItems":4096,"type":"array"},"hypothesis_id":{"type":"string"},"impact":{"type":"string"},"oracle":{"type":"object"},"path_locations":{"items":{"type":["object","string"]},"maxItems":4096,"type":"array"},"refutation_scope":{"type":["object","string","array","null"]},"reproduction_runs":{"items":{"type":["object","string"]},"maxItems":4096,"type":"array"},"source_aep":{"type":"object"},"source_aep_revision":{"type":"integer"},"target_location":{"type":"object"},"trigger_conditions":{"items":{"type":["object","string"]},"maxItems":4096,"type":"array"},"verification_verdict":{"enum":["candidate","inconclusive","refuted_scope","verified"],"type":"string"}},"required":["claim_kind","cwe_ids","evidence","hypothesis_id","impact","oracle","path_locations","refutation_scope","reproduction_runs","source_aep","source_aep_revision","target_location","trigger_conditions","verification_verdict"],"title":"lima.vulnerability-evidence-package","type":"object"}