{"claim_kind":"runtime_exploitability","cwe_ids":["CWE-78"],"evidence":[{"analysis_family":"dynamic-validation","depends_on_evidence_ids":["evidence-run-0001"],"evidence_id":"evidence-impact-0001","independence_key":"mining:impact:run-0001","level":"D4","location":null,"polarity":"supports","producer":"lima-mining","reason_codes":["ORACLE_VERIFIED"],"source_artifact_ids":["oracle-0001","run-0001"],"subject_id":"hypothesis-0001","subject_kind":"vulnerability_hypothesis","summary":"Impact, attack prerequisites, and machine oracle verified."},{"analysis_family":"dynamic-validation","depends_on_evidence_ids":[],"evidence_id":"evidence-run-0001","independence_key":"mining:repro:run-0001","level":"D3","location":null,"polarity":"supports","producer":"lima-mining","reason_codes":["RUNTIME_REPRODUCED"],"source_artifact_ids":["run-0001"],"subject_id":"hypothesis-0001","subject_kind":"vulnerability_hypothesis","summary":"Controlled-environment run reproduced the unexpected behavior."}],"hypothesis_id":"hypothesis-0001","impact":"A remote CLI argument injection allows arbitrary command execution in the deployment container.","oracle":{"content_digest":"7777777777777777777777777777777777777777777777777777777777777777","oracle_artifact_id":"oracle-0001"},"path_locations":[{"end_column":24,"end_line":20,"path":"src/cli.py","start_column":1,"start_line":20,"symbol":"main"},{"end_column":18,"end_line":10,"path":"src/example.py","start_column":5,"start_line":10,"symbol":"run_command"}],"refutation_scope":null,"reproduction_runs":[{"detail":"Deterministic PoC executed the shell metacharacter payload and observed command execution.","outcome":"reproduced","run_artifact_id":"run-0001"}],"source_aep":{"artifact_id":"aep-0001","content_digest":"f0a985432ebd11dc4b85897653cf443dc2c0b0312e453424648ebc2d164705d0","schema_version":"4.0"},"source_aep_revision":1,"target_location":{"end_column":18,"end_line":10,"path":"src/example.py","start_column":5,"start_line":10,"symbol":"run_command"},"trigger_conditions":["attacker controls the CLI argument"],"verification_verdict":"verified"}